{
  "decision": {
    "reasons": [],
    "status": "baseline"
  },
  "fingerprints": {
    "code": "sha256:e928d33c685e3503a51eeb360953744abe686869046d3ef7637a6a1a1b8660f6",
    "configuration": "sha256:a4897d46860430df697ff814c3889649ec0316fdb4deaaafc7480ef4fe616ae5",
    "corpus": "sha256:68d47873a9c605021581b1522b6b6e0fd1e486cb6ee0cf82b4633e35a76fb6f8",
    "dataset": "sha256:becc5376df64eacd168daa079ebe6a2830c42bbdcdc0528661436b296530e981"
  },
  "gates": {},
  "run": {
    "completed_at": "2026-08-06T11:17:40.150077Z",
    "dataset": "direct-rerank-smoke",
    "hardware": {
      "machine": "arm64",
      "platform": "Darwin",
      "python": "3.13.13"
    },
    "id": "eval_20260806T111737195859Z",
    "started_at": "2026-08-06T11:17:37.195859Z",
    "warmup_passes": 0,
    "workspace": "default"
  },
  "schema_version": "kip.evaluation-report.v1",
  "variants": {
    "reranked": {
      "cases": [
        {
          "case_id": "GOV-PP-003",
          "category": "semantic_paraphrase",
          "error": null,
          "expected_documents": [
            "ldoc_f6286f72ff69b81b7f879e4035b64bdd"
          ],
          "latency_ms": 2953.92625,
          "latest_version_match": null,
          "locator_match": null,
          "ndcg_at_k": 1.0,
          "ranked_documents": [
            "ldoc_f6286f72ff69b81b7f879e4035b64bdd"
          ],
          "recall_at_k": 1.0,
          "reciprocal_rank": 1.0,
          "stale_warning_match": null,
          "unauthorized_result_count": 0,
          "zero_results": false
        }
      ],
      "categories": {
        "semantic_paraphrase": {
          "case_count": 1,
          "failed_case_count": 0,
          "latest_version_accuracy": null,
          "locator_accuracy": null,
          "mrr": 1.0,
          "ndcg_at_k": 1.0,
          "recall_at_k": 1.0,
          "stale_warning_rate": null,
          "unauthorized_result_count": 0,
          "zero_result_rate": 0.0,
          "zero_result_recovery_rate": null
        }
      },
      "latency_ms": {
        "max": 2953.92625,
        "p50": 2953.92625,
        "p95": 2953.92625
      },
      "metrics": {
        "case_count": 1,
        "failed_case_count": 0,
        "latest_version_accuracy": null,
        "locator_accuracy": null,
        "mrr": 1.0,
        "ndcg_at_k": 1.0,
        "recall_at_k": 1.0,
        "stale_warning_rate": null,
        "unauthorized_result_count": 0,
        "zero_result_rate": 0.0,
        "zero_result_recovery_rate": null
      }
    }
  }
}
